{"$schema":"https://json-schema.org/draft/2020-12/schema","title":"Existing-pool live mechanics evidence","description":"Structure only: receipt authenticity, ABI semantics and ledger completeness require independent review. Missing measurements must not be represented as zero. USDC amounts use integer base units; ETH uses wei.","type":"object","additionalProperties":false,"required":["schema_version","work_id","status","chain_id","pool","token","source_manifest_sha256","claims","participant_decisions","preflight","cases","missing_evidence","review"],"properties":{"schema_version":{"const":"live-agent-evidence/1"},"work_id":{"const":"HERMES-LIVE-COMMUNITIES-20261008-r1"},"status":{"enum":["pending","preflight","active","blocked","complete"]},"chain_id":{"const":84532},"pool":{"const":"0x73872B8fB7F1771C67911f03edc75aBdc9514973"},"token":{"const":"0x036CbD53842c5426634e7929541eC2318f3dCF7e"},"source_manifest_sha256":{"$ref":"#/$defs/sha256"},"claims":{"type":"object","required":["live_mechanics_complete","outside_work_financed","independent_revenue_demonstrated","poverty_reduction_demonstrated","same_controller"],"properties":{"live_mechanics_complete":{"type":"boolean"},"outside_work_financed":{"const":false},"independent_revenue_demonstrated":{"const":false},"poverty_reduction_demonstrated":{"const":false},"same_controller":{"const":true}},"additionalProperties":false},"participant_decisions":{"type":"array","minItems":1,"items":{"$ref":"#/$defs/artifact"}},"preflight":{"oneOf":[{"type":"null"},{"$ref":"#/$defs/artifact"}]},"cases":{"type":"array","items":{"$ref":"#/$defs/case"}},"missing_evidence":{"type":"array","items":{"type":"string","minLength":1}},"review":{"type":"object","additionalProperties":false,"required":["decision","artifact"],"properties":{"decision":{"enum":["pending","accept","revise","reject"]},"artifact":{"oneOf":[{"type":"null"},{"$ref":"#/$defs/artifact"}]}}}},"$defs":{"uint":{"type":"string","pattern":"^(0|[1-9][0-9]*)$"},"sha256":{"type":"string","pattern":"^[0-9a-f]{64}$"},"hash":{"type":"string","pattern":"^0x[0-9a-fA-F]{64}$"},"address":{"type":"string","pattern":"^0x[0-9a-fA-F]{40}$"},"artifact":{"type":"object","additionalProperties":false,"required":["path_or_url","sha256","purpose"],"properties":{"path_or_url":{"type":"string","minLength":1},"sha256":{"$ref":"#/$defs/sha256"},"purpose":{"type":"string","minLength":1}}},"assertion":{"type":"object","additionalProperties":false,"required":["id","status","expected","observed","evidence_refs","reason"],"properties":{"id":{"type":"string","minLength":1},"status":{"enum":["pass","fail","missing"]},"expected":{},"observed":{},"evidence_refs":{"type":"array","items":{"type":"string","minLength":1}},"reason":{"type":"string","minLength":1}}},"case":{"type":"object","additionalProperties":false,"required":["id","status","before","after","receipts","refusal_probes","ledger","assertions","missing_evidence"],"properties":{"id":{"enum":["C1","C2","C3"]},"status":{"enum":["pending","active","blocked","complete"]},"before":{"oneOf":[{"type":"null"},{"$ref":"#/$defs/artifact"}]},"after":{"oneOf":[{"type":"null"},{"$ref":"#/$defs/artifact"}]},"receipts":{"type":"array","items":{"$ref":"#/$defs/artifact"}},"refusal_probes":{"type":"array","items":{"$ref":"#/$defs/artifact"}},"ledger":{"oneOf":[{"type":"null"},{"$ref":"#/$defs/ledger"}]},"assertions":{"type":"array","minItems":1,"items":{"$ref":"#/$defs/assertion"}},"missing_evidence":{"type":"array","items":{"type":"string","minLength":1}}},"allOf":[{"if":{"properties":{"status":{"const":"complete"}}},"then":{"properties":{"before":{"$ref":"#/$defs/artifact"},"after":{"$ref":"#/$defs/artifact"},"ledger":{"$ref":"#/$defs/ledger"},"receipts":{"minItems":1},"missing_evidence":{"maxItems":0},"assertions":{"items":{"properties":{"status":{"const":"pass"},"evidence_refs":{"minItems":1}}}}}},"else":{"properties":{"missing_evidence":{"minItems":1}}}}]},"ledger":{"type":"object","additionalProperties":false,"required":["artifact","boundary_addresses","before_wallet_usdc_units","after_wallet_usdc_units","before_pool_raw_usdc_units","after_pool_raw_usdc_units","external_inflows_units","external_outflows_units","total_fee_wei"],"properties":{"artifact":{"$ref":"#/$defs/artifact"},"boundary_addresses":{"type":"array","minItems":1,"uniqueItems":true,"items":{"$ref":"#/$defs/address"}},"before_wallet_usdc_units":{"$ref":"#/$defs/uint"},"after_wallet_usdc_units":{"$ref":"#/$defs/uint"},"before_pool_raw_usdc_units":{"$ref":"#/$defs/uint"},"after_pool_raw_usdc_units":{"$ref":"#/$defs/uint"},"external_inflows_units":{"$ref":"#/$defs/uint"},"external_outflows_units":{"$ref":"#/$defs/uint"},"total_fee_wei":{"$ref":"#/$defs/uint"}}}},"allOf":[{"if":{"properties":{"status":{"const":"complete"}}},"then":{"properties":{"preflight":{"$ref":"#/$defs/artifact"},"missing_evidence":{"maxItems":0},"cases":{"minItems":3,"maxItems":3,"items":{"properties":{"status":{"const":"complete"},"missing_evidence":{"maxItems":0}}}},"claims":{"properties":{"live_mechanics_complete":{"const":true}}},"review":{"properties":{"decision":{"const":"accept"},"artifact":{"$ref":"#/$defs/artifact"}}}}},"else":{"properties":{"claims":{"properties":{"live_mechanics_complete":{"const":false}}}}}}]}
