{"schema_version":"live-agent-evidence/1","work_id":"HERMES-LIVE-COMMUNITIES-20261008-r1","status":"active","chain_id":84532,"pool":"0x73872B8fB7F1771C67911f03edc75aBdc9514973","token":"0x036CbD53842c5426634e7929541eC2318f3dCF7e","source_manifest_sha256":"049bbddd2da08f9b7f201a13a836e7175ebbca648aeea28841fd6d3f251e8081","claims":{"live_mechanics_complete":false,"outside_work_financed":false,"independent_revenue_demonstrated":false,"poverty_reduction_demonstrated":false,"same_controller":true},"participant_decisions":[{"path_or_url":"source-manifest.json","sha256":"049bbddd2da08f9b7f201a13a836e7175ebbca648aeea28841fd6d3f251e8081","purpose":"Worker accepts task and declines unnecessary loan"}],"preflight":null,"cases":[{"id":"C1","status":"active","before":null,"after":null,"receipts":[],"refusal_probes":[],"ledger":null,"assertions":[{"id":"transaction_provenance","status":"missing","expected":"Canonical receipts and block-pinned snapshots","observed":null,"evidence_refs":[],"reason":"Fixture only: execution evidence not yet supplied."}],"missing_evidence":["Fixture only: fresh before/after snapshots, receipts and ledger remain unknown."]}],"missing_evidence":["Fixture demonstrating active-case unknowns; no live execution claim."],"review":{"decision":"pending","artifact":null}}
